{
  "device_signature_b64u": "AAECAwQFBgcICQoLDA0ODxAREhMUFRYXGBkaGxwdHh8gISIjJCUmJygpKissLS4vMDEyMzQ1Njc4OTo7PD0-Pw",
  "invitation_proof_b64u": "twUi3bjTleWDkaZRduwOY4Q5Cn_DIGwR4fhkR5hlQU4",
  "payload_b64u": "eyJhdXRob3JpdHkiOiJwcm9wb3NhbF9vbmx5IiwiY2xpZW50X25vbmNlX2I2NHUiOiJZR0ZpWTJSbFptZG9hV3ByYkcxdWJ3IiwiY3JlYXRlZF9hdCI6IjIwMjYtMDctMjlUMTA6MzE6MDAuMDAwWiIsImRlc2t0b3BfaWQiOiJ3c2Rfd1duaFp4VHVlSTZEbHl6TmNiUEVVX2lUY0N4ZFptRFAzeDNMYTVaRGJIRSIsImRldmljZV9hcHBfdmVyc2lvbiI6IjAuMS4wIiwiZGV2aWNlX2lkIjoiY3NkX2NKMEpCNHpDR0lLUXNJRlN4THp5MG93YXlTNzRBTy1HT2pZLUVvOU1Hb1kiLCJkZXZpY2VfbmFtZSI6IkNhcHR1cmUgU3BsYXQgaVBob25lIiwiZGV2aWNlX3BsYXRmb3JtIjoiaW9zIiwiZGV2aWNlX3B1YmxpY19rZXlfYjY0dSI6IkJFV0pETGhCeVl3cHVhU1V1SWhpc3ZKeUM2OWhUXzQ2aWVkeTdBTHdXaG5ieWpNYWVyQ3p3ZHpZNXh6U0NublIxSk04SDh6U1cwY2dtQWE1UGdEX3NsdyIsInBhaXJpbmdfaWQiOiJjc3BfQUFFQ0F3UUZCZ2NJQ1FvTERBME9EdyIsInJlcXVlc3RfaWQiOiJjc3JfRUJFU0V4UVZGaGNZR1JvYkhCMGVIdyIsInJlcXVlc3RlZF9wZXJtaXNzaW9ucyI6WyJyZWNlaXZlcjpzdGF0dXMiLCJzZXNzaW9uOmNyZWF0ZSIsInNlc3Npb246cmVzdW1lIiwiZnJhbWU6cHV0IiwiYXNzZXQ6cHV0Iiwic2Vzc2lvbjpmaW5hbGl6ZSJdLCJzY2hlbWEiOiJjYXB0dXJlX3NwbGF0LmxpdmVfcGFpcmluZ19yZXF1ZXN0X3BheWxvYWQudjAuMSJ9",
  "schema": "capture_splat.live_pairing_request_envelope.v0.1"
}
